{
  "$schema": "./bolt.schema.json",
  "bicepVersion": "0.17.0",
  "registry": {
    "name": "name",
    "subscriptionId": "subscriptionId",
    "tenantId": "mytenant.com"
  },
  "module": {
    "temp": "temp",
    "folder": "folder",
    "organisationStyle": {
      "type": "SingleModuleFolder",
      "filter": "*",
      "exclude": ""
    }
  },
  "publish": {
    "releaseTrigger": {
      "static": {
        "update": [
          "paramCaseModified"
        ]
      },
      "semantic": {
        "major": [
          "paramCaseModified"
        ],
        "minor": [
          "paramCaseModified"
        ],
        "patch": [
          "paramCaseModified"
        ]
      }
    },
    "defaultRelease": "dev",
    "releases": [
      {
        "name": "dev",
        "trigger": "static",
        "value": "beta-latest"
      },
      {
        "name": "dev",
        "trigger": "semantic",
        "prefix": "beta-"
      }
    ]
  }
}
